{
  "manifestVersion": 1,
  "generatedAtUtc": "2026-04-23T21:53:44.215397+00:00",
  "rootId": "arcturus_morningstar_default_swf_pack",
  "layoutKind": "classic_client_asset_root",
  "sections": {
    "gamedata": {
      "files": [
        "crossdomain.xml",
        "gamedata/HabboAvatarActions.xml",
        "gamedata/config_habbo.xml",
        "gamedata/effectmap.xml",
        "gamedata/events_list.txt",
        "gamedata/external_flash_texts.txt",
        "gamedata/external_variables.txt",
        "gamedata/figuredata.xml",
        "gamedata/figuremap.xml",
        "gamedata/furnidata.xml",
        "gamedata/habbopages/builders-club/info",
        "gamedata/habbopages/camera",
        "gamedata/habbopages/chat/chatting",
        "gamedata/habbopages/chat/commands",
        "gamedata/habbopages/chat/options",
        "gamedata/habbopages/forums",
        "gamedata/habbopages/habboclub",
        "gamedata/habbopages/hcpayday",
        "gamedata/habbopages/help/pets/training",
        "gamedata/habbopages/navigator",
        "gamedata/habbopages/wired_addons",
        "gamedata/habbopages/wired_conditions",
        "gamedata/habbopages/wired_effects",
        "gamedata/habbopages/wired_leaderboards",
        "gamedata/habbopages/wired_triggers",
        "gamedata/hotlooks.xml",
        "gamedata/override/external_flash_override_texts.txt",
        "gamedata/override/external_override_variables.txt",
        "gamedata/productdata.txt"
      ],
      "hasCoreContentMetadata": true,
      "hasFigurePartConfig": false,
      "hasSecurityCast": false,
      "textBundleFiles": [
        "gamedata/events_list.txt",
        "gamedata/external_flash_texts.txt",
        "gamedata/external_variables.txt",
        "gamedata/override/external_flash_override_texts.txt",
        "gamedata/override/external_override_variables.txt",
        "gamedata/productdata.txt"
      ]
    },
    "imageLibrary": {
      "count": 34045,
      "topFolders": [
        {
          "folder": "album1584",
          "count": 24550
        },
        {
          "folder": "catalogue",
          "count": 5442
        },
        {
          "folder": "articles",
          "count": 1550
        },
        {
          "folder": "web_promo",
          "count": 684
        },
        {
          "folder": "web_promo_small",
          "count": 589
        },
        {
          "folder": "catalogue_otherlangs",
          "count": 561
        },
        {
          "folder": "Badgeparts",
          "count": 242
        },
        {
          "folder": "Quests",
          "count": 194
        },
        {
          "folder": "album3606",
          "count": 87
        },
        {
          "folder": "newroom",
          "count": 37
        },
        {
          "folder": "guilds",
          "count": 31
        },
        {
          "folder": "Habbo-Stories",
          "count": 28
        },
        {
          "folder": "talent",
          "count": 16
        },
        {
          "folder": "reception",
          "count": 11
        },
        {
          "folder": "targetedoffers",
          "count": 8
        },
        {
          "folder": "client_static",
          "count": 5
        },
        {
          "folder": "playlist",
          "count": 5
        },
        {
          "folder": "AdWarningsUK",
          "count": 2
        },
        {
          "folder": "album137",
          "count": 1
        },
        {
          "folder": "habbopages",
          "count": 1
        }
      ],
      "badgeAssetCount": 24550,
      "campaignAssetCount": 18,
      "sample": [
        "c_images/AdWarningsUK/ad_warning_L.png",
        "c_images/AdWarningsUK/ad_warning_R.png",
        "c_images/Badgeparts/badgepart_base_advanced_1.png",
        "c_images/Badgeparts/badgepart_base_advanced_2.png",
        "c_images/Badgeparts/badgepart_base_advanced_3.png",
        "c_images/Badgeparts/badgepart_base_advanced_4.png",
        "c_images/Badgeparts/badgepart_base_basic_1.png",
        "c_images/Badgeparts/badgepart_base_basic_2.png",
        "c_images/Badgeparts/badgepart_base_basic_3.png",
        "c_images/Badgeparts/badgepart_base_basic_4.png",
        "c_images/Badgeparts/badgepart_base_basic_5.png",
        "c_images/Badgeparts/badgepart_base_beams_part1.png",
        "c_images/Badgeparts/badgepart_base_beams_part2.png",
        "c_images/Badgeparts/badgepart_base_book.png",
        "c_images/Badgeparts/badgepart_base_circles_1.png",
        "c_images/Badgeparts/badgepart_base_circles_2.png",
        "c_images/Badgeparts/badgepart_base_egg.png",
        "c_images/Badgeparts/badgepart_base_gold_1_part1.png",
        "c_images/Badgeparts/badgepart_base_gold_1_part2.png",
        "c_images/Badgeparts/badgepart_base_gold_2_part1.png",
        "c_images/Badgeparts/badgepart_base_gold_2_part2.png",
        "c_images/Badgeparts/badgepart_base_gradient_1.png",
        "c_images/Badgeparts/badgepart_base_gradient_2.png",
        "c_images/Badgeparts/badgepart_base_misc_1_part1.png",
        "c_images/Badgeparts/badgepart_base_misc_1_part2.png",
        "c_images/Badgeparts/badgepart_base_misc_2.png",
        "c_images/Badgeparts/badgepart_base_ornament.png",
        "c_images/Badgeparts/badgepart_base_ornament_1_part1.png",
        "c_images/Badgeparts/badgepart_base_ornament_1_part2.png",
        "c_images/Badgeparts/badgepart_base_ornament_2_part1.png",
        "c_images/Badgeparts/badgepart_base_ornament_2_part2.png",
        "c_images/Badgeparts/badgepart_base_pin_part1.png",
        "c_images/Badgeparts/badgepart_base_pin_part2.png",
        "c_images/Badgeparts/badgepart_base_ring.png",
        "c_images/Badgeparts/badgepart_base_shield_part1.png",
        "c_images/Badgeparts/badgepart_base_shield_part2.png",
        "c_images/Badgeparts/badgepart_base_simplestar_part1.png",
        "c_images/Badgeparts/badgepart_base_simplestar_part2.png",
        "c_images/Badgeparts/badgepart_base_spiral.png",
        "c_images/Badgeparts/badgepart_symbol_0.png"
      ]
    },
    "dcrFurnitureAssets": {
      "count": 7879,
      "adAssetCount": 212,
      "gameAssetCount": 67,
      "currencyAssetCount": 46,
      "topPrefixes": [
        {
          "prefix": "clothing",
          "count": 636
        },
        {
          "prefix": "xmas",
          "count": 326
        },
        {
          "prefix": "hween",
          "count": 269
        },
        {
          "prefix": "ads",
          "count": 212
        },
        {
          "prefix": "easter",
          "count": 206
        },
        {
          "prefix": "room",
          "count": 173
        },
        {
          "prefix": "wf",
          "count": 94
        },
        {
          "prefix": "bazaar",
          "count": 92
        },
        {
          "prefix": "rare",
          "count": 81
        },
        {
          "prefix": "sound",
          "count": 81
        },
        {
          "prefix": "horse",
          "count": 76
        },
        {
          "prefix": "jungle",
          "count": 73
        },
        {
          "prefix": "diamond",
          "count": 67
        },
        {
          "prefix": "pixel",
          "count": 66
        },
        {
          "prefix": "plushie",
          "count": 65
        },
        {
          "prefix": "bc",
          "count": 63
        },
        {
          "prefix": "habbo15",
          "count": 57
        },
        {
          "prefix": "pirate",
          "count": 57
        },
        {
          "prefix": "xmas11",
          "count": 57
        },
        {
          "prefix": "uni",
          "count": 55
        }
      ],
      "sample": [
        "CFC_100_coin_gold.swf",
        "CFC_10_coin_bronze.swf",
        "CFC_200_moneybag.swf",
        "CFC_500_goldbar.swf",
        "CFC_50_coin_silver.swf",
        "CF_1000_goldenkey.swf",
        "CF_10_coin_gold.swf",
        "CF_1200_ny16.swf",
        "CF_120_sapphire_small.swf",
        "CF_1500_suitcase.swf",
        "CF_1500_suitcase2.swf",
        "CF_1_coin_bronze.swf",
        "CF_200_ruby.swf",
        "CF_20_moneybag.swf",
        "CF_240_sapphire.swf",
        "CF_250_Hucci.swf",
        "CF_250_fancywatch.swf",
        "CF_250_toiletpaper.swf",
        "CF_300_bricks.swf",
        "CF_350_duck.swf",
        "CF_350_giantpearl.swf",
        "CF_350_jadefish.swf",
        "CF_350_sceptre.swf",
        "CF_350_skull.swf",
        "CF_350_sparklybag.swf",
        "CF_5000_suitcase.swf",
        "CF_500_egg.swf",
        "CF_500_goldenbeetle.swf",
        "CF_500_moneytree.swf",
        "CF_500_orb.swf",
        "CF_500_platinum_bar.swf",
        "CF_500_vikings.swf",
        "CF_50_goldbar.swf",
        "CF_5_coin_silver.swf",
        "CF_750_duck.swf",
        "CF_750_evilskull.swf",
        "CF_750_golddragon.swf",
        "CF_750_goldenpig.swf",
        "CF_750_minihabberge.swf",
        "CF_750_perfume.swf"
      ]
    },
    "gordonPackages": {
      "count": 1,
      "packageKeys": [
        "PRODUCTION"
      ]
    },
    "coreClientPackages": {
      "count": 2,
      "sample": [
        "Habbo.swf",
        "HabboRoomContent.swf"
      ]
    },
    "gamePackages": {
      "count": 2,
      "sample": [
        "BaseJump.swf",
        "BasicAssets.swf"
      ]
    },
    "publicRoomPackages": {
      "count": 0,
      "brandedVariantCount": 0,
      "regionalVariantCount": 0,
      "sample": []
    },
    "avatarAssets": {
      "count": 1881,
      "figureLibraryCount": 0,
      "humanLibraryCount": 28,
      "partVariantCount": 1853,
      "sample": [
        "acc_U_antlers15.swf",
        "acc_chest_M_fish.swf",
        "acc_chest_U_backpack.swf",
        "acc_chest_U_bamboobackpack.swf",
        "acc_chest_U_beads.swf",
        "acc_chest_U_bear.swf",
        "acc_chest_U_belv.swf",
        "acc_chest_U_binoculars.swf",
        "acc_chest_U_bohobackpack.swf",
        "acc_chest_U_bohobag.swf",
        "acc_chest_U_bookbag.swf",
        "acc_chest_U_bow.swf",